{
  "seed": "zn-0034-correction-seed-v1",
  "seedDigest": "2222222222222222222222222222222222222222222222222222222222222222",
  "purpose": "operations",
  "caseId": "case-order-qty-1",
  "questionDigest": "3333333333333333333333333333333333333333333333333333333333333333",
  "cutDigest": "4444444444444444444444444444444444444444444444444444444444444444",
  "priorCutDigest": "5555555555555555555555555555555555555555555555555555555555555555",
  "amountBefore": "80",
  "amountAfter": "100"
}
